{
  "$id": "https://posthog-impact.local/schemas/pull_requests.schema.json",
  "$schema": "https://json-schema.org/draft/2020-12/schema",
  "additionalProperties": false,
  "properties": {
    "assignee_logins": {
      "arrow_type": "list<element: string>",
      "type": [
        "array",
        "null"
      ]
    },
    "author_actor_id": {
      "arrow_type": "string",
      "type": [
        "string",
        "null"
      ]
    },
    "author_bot_probability": {
      "arrow_type": "double",
      "type": [
        "number",
        "null"
      ]
    },
    "author_is_bot": {
      "arrow_type": "bool",
      "type": [
        "boolean",
        "null"
      ]
    },
    "author_login": {
      "arrow_type": "string",
      "type": [
        "string",
        "null"
      ]
    },
    "author_typename": {
      "arrow_type": "string",
      "type": [
        "string",
        "null"
      ]
    },
    "base_ref": {
      "arrow_type": "string",
      "type": [
        "string",
        "null"
      ]
    },
    "base_sha": {
      "arrow_type": "string",
      "type": [
        "string",
        "null"
      ]
    },
    "body_length": {
      "arrow_type": "int64",
      "type": [
        "integer",
        "null"
      ]
    },
    "body_text": {
      "arrow_type": "string",
      "type": [
        "string",
        "null"
      ]
    },
    "bulk_category": {
      "arrow_type": "string",
      "type": [
        "string",
        "null"
      ]
    },
    "bulk_share": {
      "arrow_type": "double",
      "type": [
        "number",
        "null"
      ]
    },
    "closed_at": {
      "arrow_type": "string",
      "type": [
        "string",
        "null"
      ]
    },
    "cohorts": {
      "arrow_type": "list<element: string>",
      "type": [
        "array",
        "null"
      ]
    },
    "comment_count": {
      "arrow_type": "int64",
      "type": [
        "integer",
        "null"
      ]
    },
    "commit_count": {
      "arrow_type": "int64",
      "type": [
        "integer",
        "null"
      ]
    },
    "computed_at": {
      "arrow_type": "string",
      "type": [
        "string",
        "null"
      ]
    },
    "context_only": {
      "arrow_type": "bool",
      "type": [
        "boolean",
        "null"
      ]
    },
    "created_at": {
      "arrow_type": "string",
      "type": [
        "string",
        "null"
      ]
    },
    "created_in_window": {
      "arrow_type": "bool",
      "type": [
        "boolean",
        "null"
      ]
    },
    "database_id": {
      "arrow_type": "int64",
      "type": [
        "integer",
        "null"
      ]
    },
    "git_additions": {
      "arrow_type": "int64",
      "type": [
        "integer",
        "null"
      ]
    },
    "git_deletions": {
      "arrow_type": "int64",
      "type": [
        "integer",
        "null"
      ]
    },
    "git_file_count": {
      "arrow_type": "int64",
      "type": [
        "integer",
        "null"
      ]
    },
    "github_additions": {
      "arrow_type": "int64",
      "type": [
        "integer",
        "null"
      ]
    },
    "github_changed_files": {
      "arrow_type": "int64",
      "type": [
        "integer",
        "null"
      ]
    },
    "github_deletions": {
      "arrow_type": "int64",
      "type": [
        "integer",
        "null"
      ]
    },
    "has_binary_files": {
      "arrow_type": "bool",
      "type": [
        "boolean",
        "null"
      ]
    },
    "has_merge_commit_in_clone": {
      "arrow_type": "bool",
      "type": [
        "boolean",
        "null"
      ]
    },
    "head_ref": {
      "arrow_type": "string",
      "type": [
        "string",
        "null"
      ]
    },
    "head_repository_owner": {
      "arrow_type": "string",
      "type": [
        "string",
        "null"
      ]
    },
    "head_sha": {
      "arrow_type": "string",
      "type": [
        "string",
        "null"
      ]
    },
    "is_bulk_change": {
      "arrow_type": "bool",
      "type": [
        "boolean",
        "null"
      ]
    },
    "is_cross_repository": {
      "arrow_type": "bool",
      "type": [
        "boolean",
        "null"
      ]
    },
    "is_draft": {
      "arrow_type": "bool",
      "type": [
        "boolean",
        "null"
      ]
    },
    "is_merge_queue_artifact": {
      "arrow_type": "bool",
      "type": [
        "boolean",
        "null"
      ]
    },
    "label_count": {
      "arrow_type": "int64",
      "type": [
        "integer",
        "null"
      ]
    },
    "labels": {
      "arrow_type": "list<element: string>",
      "type": [
        "array",
        "null"
      ]
    },
    "merge_commit_sha": {
      "arrow_type": "string",
      "type": [
        "string",
        "null"
      ]
    },
    "merged_at": {
      "arrow_type": "string",
      "type": [
        "string",
        "null"
      ]
    },
    "merged_by_actor_id": {
      "arrow_type": "string",
      "type": [
        "string",
        "null"
      ]
    },
    "merged_by_login": {
      "arrow_type": "string",
      "type": [
        "string",
        "null"
      ]
    },
    "merged_in_window": {
      "arrow_type": "bool",
      "type": [
        "boolean",
        "null"
      ]
    },
    "milestone_title": {
      "arrow_type": "string",
      "type": [
        "string",
        "null"
      ]
    },
    "node_id": {
      "arrow_type": "string",
      "type": [
        "string",
        "null"
      ]
    },
    "participant_count": {
      "arrow_type": "int64",
      "type": [
        "integer",
        "null"
      ]
    },
    "participant_logins": {
      "arrow_type": "list<element: string>",
      "type": [
        "array",
        "null"
      ]
    },
    "pr_id": {
      "arrow_type": "string",
      "type": [
        "string",
        "null"
      ]
    },
    "pr_number": {
      "arrow_type": "int64",
      "type": [
        "integer",
        "null"
      ]
    },
    "ranking_eligible": {
      "arrow_type": "bool",
      "type": [
        "boolean",
        "null"
      ]
    },
    "ranking_ineligible_reason": {
      "arrow_type": "string",
      "type": [
        "string",
        "null"
      ]
    },
    "reaction_count": {
      "arrow_type": "int64",
      "type": [
        "integer",
        "null"
      ]
    },
    "repository": {
      "arrow_type": "string",
      "type": [
        "string",
        "null"
      ]
    },
    "review_count": {
      "arrow_type": "int64",
      "type": [
        "integer",
        "null"
      ]
    },
    "review_detail_fetched": {
      "arrow_type": "bool",
      "type": [
        "boolean",
        "null"
      ]
    },
    "review_thread_count": {
      "arrow_type": "int64",
      "type": [
        "integer",
        "null"
      ]
    },
    "schema_version": {
      "arrow_type": "string",
      "type": [
        "string",
        "null"
      ]
    },
    "state": {
      "arrow_type": "string",
      "type": [
        "string",
        "null"
      ]
    },
    "title_breaking": {
      "arrow_type": "bool",
      "type": [
        "boolean",
        "null"
      ]
    },
    "title_class": {
      "arrow_type": "string",
      "type": [
        "string",
        "null"
      ]
    },
    "title_parser_confidence": {
      "arrow_type": "double",
      "type": [
        "number",
        "null"
      ]
    },
    "title_parser_notes": {
      "arrow_type": "list<element: string>",
      "type": [
        "array",
        "null"
      ]
    },
    "title_parser_status": {
      "arrow_type": "string",
      "type": [
        "string",
        "null"
      ]
    },
    "title_prefix": {
      "arrow_type": "string",
      "type": [
        "string",
        "null"
      ]
    },
    "title_prefix_raw": {
      "arrow_type": "string",
      "type": [
        "string",
        "null"
      ]
    },
    "title_raw": {
      "arrow_type": "string",
      "type": [
        "string",
        "null"
      ]
    },
    "title_scope": {
      "arrow_type": "string",
      "type": [
        "string",
        "null"
      ]
    },
    "title_squash_pr_number": {
      "arrow_type": "int64",
      "type": [
        "integer",
        "null"
      ]
    },
    "title_subject": {
      "arrow_type": "string",
      "type": [
        "string",
        "null"
      ]
    },
    "updated_at": {
      "arrow_type": "string",
      "type": [
        "string",
        "null"
      ]
    },
    "url": {
      "arrow_type": "string",
      "type": [
        "string",
        "null"
      ]
    }
  },
  "title": "pull_requests",
  "type": "object",
  "x-pipeline-version": "1.0.0",
  "x-schema-version": "1.0.0"
}
