[
  {
    "assignee_logins": [],
    "author_actor_id": "github/user/webjunkie",
    "author_bot_probability": 0.0,
    "author_is_bot": false,
    "author_login": "webjunkie",
    "author_typename": "User",
    "base_ref": "master",
    "base_sha": "d2bd74e10ad4bfe915949c41c8ace518bfba7abc",
    "body_length": 873,
    "body_text": "Problem: Dev env vars scattered across bin/start, bin/start-backend, and bin/start-celery with duplicates. AI developers need to manually wrap commands with op run --env-file=.env.local for 1Password ",
    "bulk_category": null,
    "bulk_share": null,
    "closed_at": "2026-05-20T07:59:49Z",
    "cohorts": [
      "merged"
    ],
    "comment_count": 14,
    "commit_count": 21,
    "computed_at": "2026-08-17T14:45:00.356291Z",
    "context_only": false,
    "created_at": "2026-01-22T13:30:17Z",
    "created_in_window": false,
    "database_id": 3199395601,
    "git_additions": 279,
    "git_deletions": 96,
    "git_file_count": 16,
    "github_additions": 279,
    "github_changed_files": 16,
    "github_deletions": 96,
    "has_binary_files": false,
    "has_merge_commit_in_clone": true,
    "head_ref": "chore/consolidate-dev-env-vars",
    "head_repository_owner": "PostHog",
    "head_sha": "61e6b649f2b353ad536ea63f607a47281f45f2df",
    "is_bulk_change": false,
    "is_cross_repository": false,
    "is_draft": false,
    "is_merge_queue_artifact": false,
    "label_count": 2,
    "labels": [
      "hobby-preview",
      "run-playwright"
    ],
    "merge_commit_sha": "f26fd80da01ae8b1856203b70d36c38d14623948",
    "merged_at": "2026-05-20T07:59:49Z",
    "merged_by_actor_id": "github/user/webjunkie",
    "merged_by_login": "webjunkie",
    "merged_in_window": true,
    "milestone_title": null,
    "node_id": "PR_kwDODg-Tdc6-sucR",
    "participant_count": 5,
    "participant_logins": [
      "webjunkie",
      "oliverb123",
      "Piccirello",
      "rafaeelaudibert",
      "Copilot"
    ],
    "pr_id": "github.com/PostHog/posthog#pr/45696",
    "pr_number": 45696,
    "ranking_eligible": true,
    "ranking_ineligible_reason": null,
    "reaction_count": 3,
    "repository": "github.com/PostHog/posthog",
    "review_count": 14,
    "review_detail_fetched": true,
    "review_thread_count": 11,
    "schema_version": "1.0.0",
    "state": "MERGED",
    "title_breaking": false,
    "title_class": null,
    "title_parser_confidence": 0.98,
    "title_parser_notes": [],
    "title_parser_status": "strict",
    "title_prefix": "chore",
    "title_prefix_raw": "chore",
    "title_raw": "chore(dev): consolidate env vars, auto-resolve 1Password secrets",
    "title_scope": "dev",
    "title_squash_pr_number": null,
    "title_subject": "consolidate env vars, auto-resolve 1Password secrets",
    "updated_at": "2026-05-20T08:49:45Z",
    "url": "https://github.com/PostHog/posthog/pull/45696"
  },
  {
    "assignee_logins": [
      "gantoine"
    ],
    "author_actor_id": "github/user/dependabot",
    "author_bot_probability": 1.0,
    "author_is_bot": true,
    "author_login": "dependabot",
    "author_typename": "Bot",
    "base_ref": "master",
    "base_sha": "810c405e198bf1666c39b109673466b8f19d86ac",
    "body_length": 425,
    "body_text": "Bumps dtolnay/rust-toolchain from 0b1efabc08b657293548b77fb76cc02d26091c7e to 3c5f7ea28cd621ae0bf5283f0e981fb97b8a7af9.\n\nCommits\n\n3c5f7ea Add 1.94.1 patch release\nefa25f7 Add 1.93.1 patch release\nf7cc",
    "bulk_category": null,
    "bulk_share": null,
    "closed_at": "2026-05-21T17:58:52Z",
    "cohorts": [
      "merged"
    ],
    "comment_count": 9,
    "commit_count": 3,
    "computed_at": "2026-08-17T14:45:00.358052Z",
    "context_only": false,
    "created_at": "2026-01-31T10:02:21Z",
    "created_in_window": false,
    "database_id": 3230488421,
    "git_additions": 19,
    "git_deletions": 19,
    "git_file_count": 11,
    "github_additions": 19,
    "github_changed_files": 12,
    "github_deletions": 21,
    "has_binary_files": false,
    "has_merge_commit_in_clone": true,
    "head_ref": "dependabot/github_actions/dtolnay/rust-toolchain-f7ccc83f9ed1e5b9c81d8a67d7ad1a747e22a561",
    "head_repository_owner": "PostHog",
    "head_sha": "a9e56a53b3e9151eb64b20f81e354826d37e6d9d",
    "is_bulk_change": false,
    "is_cross_repository": false,
    "is_draft": false,
    "is_merge_queue_artifact": false,
    "label_count": 3,
    "labels": [
      "dependencies",
      "stale",
      "github_actions"
    ],
    "merge_commit_sha": "dced1e668ada50b57fb1c7e189b997811c0c9fdc",
    "merged_at": "2026-05-21T17:58:52Z",
    "merged_by_actor_id": "github/user/gantoine",
    "merged_by_login": "gantoine",
    "merged_in_window": true,
    "milestone_title": null,
    "node_id": "PR_kwDODg-Tdc7AjVdl",
    "participant_count": 2,
    "participant_logins": [
      "rafaeelaudibert",
      "gantoine"
    ],
    "pr_id": "github.com/PostHog/posthog#pr/46473",
    "pr_number": 46473,
    "ranking_eligible": true,
    "ranking_ineligible_reason": null,
    "reaction_count": 1,
    "repository": "github.com/PostHog/posthog",
    "review_count": 1,
    "review_detail_fetched": true,
    "review_thread_count": 0,
    "schema_version": "1.0.0",
    "state": "MERGED",
    "title_breaking": false,
    "title_class": "dependency_bump",
    "title_parser_confidence": 0.98,
    "title_parser_notes": [
      "matched non-standard title class: dependency_bump"
    ],
    "title_parser_status": "strict",
    "title_prefix": "chore",
    "title_prefix_raw": "chore",
    "title_raw": "chore(deps): bump dtolnay/rust-toolchain from 0b1efabc08b657293548b77fb76cc02d26091c7e to 3c5f7ea28cd621ae0bf5283f0e981fb97b8a7af9",
    "title_scope": "deps",
    "title_squash_pr_number": null,
    "title_subject": "bump dtolnay/rust-toolchain from 0b1efabc08b657293548b77fb76cc02d26091c7e to 3c5f7ea28cd621ae0bf5283f0e981fb97b8a7af9",
    "updated_at": "2026-05-21T18:46:52Z",
    "url": "https://github.com/PostHog/posthog/pull/46473"
  },
  {
    "assignee_logins": [
      "gantoine"
    ],
    "author_actor_id": "github/user/dependabot",
    "author_bot_probability": 1.0,
    "author_is_bot": true,
    "author_login": "dependabot",
    "author_typename": "Bot",
    "base_ref": "master",
    "base_sha": "44fff20aa192a5895f03aabd9065d2130e88679b",
    "body_length": 641,
    "body_text": "Bumps storybook from 7.6.4 to 7.6.21.\n\nNote\nThe original Dependabot-generated changelog snippet below was scraped from Storybook's next branch and described the 10.4.0 release, which is unrelated to t",
    "bulk_category": null,
    "bulk_share": null,
    "closed_at": "2026-05-21T15:22:09Z",
    "cohorts": [
      "merged"
    ],
    "comment_count": 8,
    "commit_count": 6,
    "computed_at": "2026-08-17T14:45:00.361270Z",
    "context_only": false,
    "created_at": "2026-02-03T18:55:41Z",
    "created_in_window": false,
    "database_id": 3242495490,
    "git_additions": 1306,
    "git_deletions": 400,
    "git_file_count": 4,
    "github_additions": 1306,
    "github_changed_files": 4,
    "github_deletions": 400,
    "has_binary_files": false,
    "has_merge_commit_in_clone": true,
    "head_ref": "dependabot/npm_and_yarn/storybook-7.6.21",
    "head_repository_owner": "PostHog",
    "head_sha": "8fc54d77039b4c1492eb9e40a2900062c5063c3e",
    "is_bulk_change": false,
    "is_cross_repository": false,
    "is_draft": false,
    "is_merge_queue_artifact": false,
    "label_count": 2,
    "labels": [
      "dependencies",
      "javascript"
    ],
    "merge_commit_sha": "bb7f862486f49f0986d4d2d2347f24e1f6e2fb4d",
    "merged_at": "2026-05-21T15:22:09Z",
    "merged_by_actor_id": "github/user/gantoine",
    "merged_by_login": "gantoine",
    "merged_in_window": true,
    "milestone_title": null,
    "node_id": "PR_kwDODg-Tdc7BRI4C",
    "participant_count": 3,
    "participant_logins": [
      "rafaeelaudibert",
      "gantoine",
      "Copilot"
    ],
    "pr_id": "github.com/PostHog/posthog#pr/46726",
    "pr_number": 46726,
    "ranking_eligible": true,
    "ranking_ineligible_reason": null,
    "reaction_count": 1,
    "repository": "github.com/PostHog/posthog",
    "review_count": 2,
    "review_detail_fetched": true,
    "review_thread_count": 2,
    "schema_version": "1.0.0",
    "state": "MERGED",
    "title_breaking": false,
    "title_class": "dependency_bump",
    "title_parser_confidence": 0.98,
    "title_parser_notes": [
      "matched non-standard title class: dependency_bump"
    ],
    "title_parser_status": "strict",
    "title_prefix": "chore",
    "title_prefix_raw": "chore",
    "title_raw": "chore(deps): bump storybook from 7.6.4 to 7.6.21",
    "title_scope": "deps",
    "title_squash_pr_number": null,
    "title_subject": "bump storybook from 7.6.4 to 7.6.21",
    "updated_at": "2026-05-21T16:11:00Z",
    "url": "https://github.com/PostHog/posthog/pull/46726"
  },
  {
    "assignee_logins": [
      "gantoine"
    ],
    "author_actor_id": "github/user/dependabot",
    "author_bot_probability": 1.0,
    "author_is_bot": true,
    "author_login": "dependabot",
    "author_typename": "Bot",
    "base_ref": "master",
    "base_sha": "b431b9d3205a6a5f1f5512f42e2c4b7260adc8aa",
    "body_length": 3011,
    "body_text": "Bumps esbuild from 0.25.10 to 0.25.11.\n\nRelease notes\nSourced from esbuild's releases.\n\nv0.25.11\n\n\nAdd support for with { type: 'bytes' } imports (#4292)\nThe import bytes proposal has reached stage 2.",
    "bulk_category": null,
    "bulk_share": null,
    "closed_at": "2026-05-29T14:52:34Z",
    "cohorts": [
      "merged"
    ],
    "comment_count": 10,
    "commit_count": 3,
    "computed_at": "2026-08-17T14:45:00.362457Z",
    "context_only": false,
    "created_at": "2026-02-04T02:47:46Z",
    "created_in_window": false,
    "database_id": 3243848513,
    "git_additions": 127,
    "git_deletions": 127,
    "git_file_count": 4,
    "github_additions": 127,
    "github_changed_files": 4,
    "github_deletions": 127,